{
  "$id": "EQ6c_J0uQVr-9yekX4dkguc0fLI2sB1wZbGbe5Mvedro",
  "$schema": "http://json-schema.org/draft-07/schema#",
  "additionalProperties": false,
  "properties": {
    "credentialStatus": {
      "properties": {
        "id": {
          "type": "string"
        },
        "type": {
          "type": "string"
        }
      },
      "required": [
        "id"
      ],
      "type": "object"
    },
    "credentialSubject": {
      "properties": {
        "LEI": {
          "type": "string"
        },
        "officialRole": {
          "type": "string"
        },
        "personLegalName": {
          "type": "string"
        },
        "qualifiedvLEIIssuervLEICredential": {
          "type": "string"
        }
      },
      "additionalProperties": false,
      "required": [
        "LEI",
        "personLegalName",
        "officialRole",
        "qualifiedvLEIIssuervLEICredential"
      ],
      "type": "object"
    },
    "issuanceDate": {
      "format": "date-time",
      "type": "string"
    },
    "issuer": {
      "type": "string"
    },
    "type": {
      "contains": {
        "const": "LegalEntityOfficialOrganizationalRolevLEICredential"
      },
      "type": "array"
    }
  },
  "required": [
    "type",
    "issuer",
    "issuanceDate",
    "credentialSubject",
    "credentialStatus"
  ],
  "type": "object"
}